Nome,E-mail / lattes,Primeiro contato,Situação atual,obs
Valter Gomes Santos de Oliveira,valveira@hotmail.com,NAN,Não contactado,
Washington Luis Lima Drummond,wodrum@hotmail.com,NAN,Não contactado,
Moiseis de Oliveira Sampaio,mosampaio@hotmail.com ,NAN,Não contactado,
Mariza do Carmo Rodrigues,marizacarmo@hotmail.com,NAN,Não contactado,
Maria Dalva de Lima Macêdo,dalva_macedo@ig.com.br ,NAN,Não contactado,
Jackson André da Silva Ferreira,ferreirajack@uol.com.br ,NAN,Não contactado,
José Carlos de Araujo Silva,zecaasilva@ibest.com.br ,NAN,Não contactado,
Jerônimo Jorge Cavalcante Silva,jorgeazul53@gmail.com,NAN,Não contactado,
Joelma Ferreira dos Santos,joesantos2@hotmail.com,NAN,Não contactado,
